{
  "schema_version": 3,
  "packet_type": "issue_worker_dispatch",
  "task_kind": "implement",
  "access_mode": "read_write",
  "source_revision": {
    "approved_spec_binding": {
      "path": "knowledge/wiki/syntheses/<epic-id>-input-packet.json",
      "sha256": "<raw-byte-sha256>",
      "gate_commit": "<full-gate-commit>"
    },
    "execution_envelope": {
      "path": "/abs/path/to/execution-envelope.json",
      "revision": 1,
      "sha256": "<sha256>"
    },
    "runtime_state": {
      "path": "/abs/path/to/runtime-state.json",
      "envelope_revision": 1,
      "sha256": "<sha256>"
    },
    "issue_source": {
      "path": "knowledge/wiki/syntheses/issues.md",
      "sha256": "<sha256>"
    }
  },
  "epic_id": "<epic-id>",
  "issue_id": "G2PR-001",
  "issue_title": "短い日本語 issue タイトル",
  "dispatch_id": "dispatch-001",
  "branch": "codex/<epic-id>/G2PR-001-<slug>",
  "worktree": "/abs/path/to/worktree",
  "write_scope": [
    "path:<scope>"
  ],
  "context_policy": {
    "paths_first": true,
    "max_packet_words": 450,
    "hard_max_packet_words": 800,
    "max_read_paths": 8,
    "max_inline_excerpt_words_per_file": 120,
    "max_inline_excerpt_words_total": 300,
    "include_full_spec_text": false,
    "include_full_ledger_text": false
  },
  "read_paths": [
    {
      "path": "knowledge/wiki/syntheses/spec.md",
      "purpose": "spec"
    },
    {
      "path": "knowledge/wiki/syntheses/issues.md",
      "purpose": "issue-ledger"
    }
  ],
  "inline_context": [
    {
      "path": "knowledge/wiki/syntheses/issues.md",
      "excerpt": "issue に必要な短い抜粋のみ。"
    }
  ],
  "task": {
    "summary": "必要な挙動の短い要約。",
    "acceptance_criteria": [
      "観測可能な受け入れ条件"
    ],
    "verification": [
      "python3 -m unittest discover -s tests"
    ],
    "stop_conditions": [
      "明示承認がない remote write の前で停止する。"
    ]
  },
  "report_contract": {
    "format": "worker-report.json",
    "validator": "skills/issue-implementation-loop/scripts/validate_worker_report.py"
  }
}
